title,content,author,date_publish,link
Isamu Noguchi: Design & Art for a better world,"One of the most important artists of his time — Isamu noguchi lived an inspiring life. His designs, art, and inventions live on to inspire.","Isamu Noguchi: Design & Art for a better world One of the most important artists of his time — Isamu noguchi lived an inspiring life. His designs, art, and inventions live on to inspire. Karen Tsui","Sep 26, 2019·6 min read","Isamu Noguchi: Design & Art for a better world One of the most important artists of his time — Isamu noguchi lived an inspiring life. His designs, art, and inventions live on to inspire.  Karen Tsui"
Leonardo da Vinci and the Enigmatic Smile of the Mona Lisa,An overview of the Mona Lisa (1503–1506) and some of the contributions Leonardo da Vinci (1452–1519) made in his lifetime.,Leonardo da Vinci and the Enigmatic Smile of the Mona Lisa An overview of the Mona Lisa (1503–1506) and some of the contributions Leonardo da Vinci (1452–1519) made in his lifetime. Charles Beuck in Traveling through History,"Dec 19, 2019·6 min read",Leonardo da Vinci and the Enigmatic Smile of the Mona Lisa An overview of the Mona Lisa (1503–1506) and some of the contributions Leonardo da Vinci (1452–1519) made in his lifetime.  Charles Beuck in Traveling through History
To See and Be Seen,Photographer Alec Soth on the intimate art of exposing lives,To See and Be Seen Photographer Alec Soth on the intimate art of exposing lives Minneapolis Institute of Art in Minneapolis Institute of Art,"Dec 19, 2019·4 min read",To See and Be Seen Photographer Alec Soth on the intimate art of exposing lives  Minneapolis Institute of Art in Minneapolis Institute of Art
What a Museum Security Guard Taught Me About Art,A visit to the Met Cloisters and seeing the Mérode Altarpiece for the first time,What a Museum Security Guard Taught Me About Art A visit to the Met Cloisters and seeing the Mérode Altarpiece for the first time Nicole Bianchi in The Inkwell: Stories,"Dec 19, 2019·5 min read",What a Museum Security Guard Taught Me About Art A visit to the Met Cloisters and seeing the Mérode Altarpiece for the first time  Nicole Bianchi in The Inkwell: Stories
4 Stories to Boost Your Creativity,"Creativity doesn’t happen in a vacuum, and other insights from Forge","4 Stories to Boost Your Creativity Creativity doesn’t happen in a vacuum, and other insights from Forge Indrani Sen in Forge","Dec 24, 2019·3 min read","4 Stories to Boost Your Creativity Creativity doesn’t happen in a vacuum, and other insights from Forge  Indrani Sen in Forge"
A Thank You Note to All Artists,"Never doubt that you and your craft have changed, and even saved, lives.","A Thank You Note to All Artists Never doubt that you and your craft have changed, and even saved, lives. Dawn Bevier in P.S. I Love You","Dec 18, 2019·5 min read","A Thank You Note to All Artists Never doubt that you and your craft have changed, and even saved, lives.  Dawn Bevier in P.S. I Love You"
Something good at El Tapatio  —  artist Higgy Vasquez restores “Recuerdos de mi Pueblo.”,"Higgy Vasquez worked with his father, Emigdio, since he was a young boy painting murals in Orange County","Something good at El Tapatio  —  artist Higgy Vasquez restores “Recuerdos de mi Pueblo.” Higgy Vasquez worked with his father, Emigdio, since he was a young boy painting murals in Orange County Katherine Bowers","Dec 15, 2019·4 min read","Something good at El Tapatio  —  artist Higgy Vasquez restores “Recuerdos de mi Pueblo.” Higgy Vasquez worked with his father, Emigdio, since he was a young boy painting murals in Orange County  Katherine Bowers"
What about your Stendhal Syndrome?,Swooning in the presence of great art,What about your Stendhal Syndrome? Swooning in the presence of great art Vlad Alex (Merzmensch) in The Narrative,"Dec 18, 2019·3 min read",What about your Stendhal Syndrome? Swooning in the presence of great art  Vlad Alex (Merzmensch) in The Narrative
Surrealistic Realism at Nature’s Mercy: Guy Kinnear’s Golems,"Guy Kinnear lives and works on the Californian countryside, where he models and paints humanoid figures on the backdrop of local…","Surrealistic Realism at Nature’s Mercy: Guy Kinnear’s Golems Guy Kinnear lives and works on the Californian countryside, where he models and paints humanoid figures on the backdrop of local… MutualArt in MutualArt Magazine","Dec 17, 2019·7 min read","Surrealistic Realism at Nature’s Mercy: Guy Kinnear’s Golems Guy Kinnear lives and works on the Californian countryside, where he models and paints humanoid figures on the backdrop of local…  MutualArt in MutualArt Magazine"
How I Deliberately Destroyed over £1m of Irreplaceable Art,Please don’t shout at me. I’m still dealing with it.,How I Deliberately Destroyed over £1m of Irreplaceable Art Please don’t shout at me. I’m still dealing with it. Jason Deane in The Partnered Pen,"Dec 17, 2019·8 min read",How I Deliberately Destroyed over £1m of Irreplaceable Art Please don’t shout at me. I’m still dealing with it.  Jason Deane in The Partnered Pen